[
  {
    "part_number": "NE555DR",
    "manufacturer": "Texas Instruments",
    "manufacturer_id": "texas-instruments",
    "category": "Semiconductors",
    "category_slug": "semiconductors",
    "sub_category": "Integrated Circuits",
    "sub_category_slug": "integrated-circuits",
    "package": "SOIC-8",
    "origin": "USA",
    "datasheet_url": "https://www.ti.com/lit/ds/symlink/ne555.pdf",
    "description": "Precision timer IC",
    "status": "active",
    "attributes": {
      "type": "Timer",
      "supply_voltage_min_v": 4.5,
      "supply_voltage_max_v": 16
    },
    "tags": ["timer", "555"],
    "updated_at": "2026-07-14"
  }
]
